{
  "$schema": "../schemas/pitch_angle.schema.json",
  "$comment": "Curated library of pitch angles the AI generation pipeline draws from. Phrasings use AGENT-LED ON-BEHALF-OF voice (v1.1) \u2014 emails are sent by the talent's agency, not the talent themselves. The LLM rewrites tone/context; merge fields with {curly_braces} are substituted at generation time. talent_name is required in nearly every phrasing now. Edit angles freely as the user learns what works. v2 may add per-angle voice_mode overrides for agencies that prefer talent-led messaging.",
  "version": "1.1.0",
  "updated": "2026-05-26",
  "angles": [
    {
      "angle_id": "past_brand_direct_competitor",
      "category": "competitive_proof",
      "name": "Worked with a direct competitor",
      "description": "Talent has proven track record with a brand the contact's brand directly competes with (per the curated brand_competitors.json graph, not just same industry_id). Strongest competitive proof \u2014 shows fit AND creates FOMO.",
      "trigger": {
        "type": "talent_worked_with_competitor",
        "config": {
          "min_competitor_overlap": 1
        }
      },
      "applicable_to_decision_roles": [
        "buyer",
        "influencer"
      ],
      "applicable_to_steps": [
        1,
        2
      ],
      "authored_strength_score": 0.95,
      "example_phrasing": "{talent_name} recently wrapped a campaign with {competitor_brand} \u2014 same vertical, similar audience overlap with {target_brand}. The {format} hit {metric} with a {engagement_rate} engagement rate. {target_brand} hasn't worked with someone in {talent_name}'s space yet \u2014 happy to share the full audit.",
      "merge_fields_required": [
        "talent_name",
        "competitor_brand",
        "target_brand",
        "format",
        "metric",
        "engagement_rate"
      ],
      "pair_well_with": [
        "iab_demographic_overlap",
        "specific_creative_concept",
        "values_aligned_search"
      ],
      "avoid_combining_with": [
        "talent_worked_in_same_industry",
        "talent_worked_in_tertiary_industry"
      ],
      "notes": "Highest authored strength. Use with care if competitor is a particularly bitter rival \u2014 frame as 'proven track record in this space' not 'I left them for you'."
    },
    {
      "angle_id": "past_brand_same_industry",
      "category": "competitive_proof",
      "name": "Worked with a same-industry brand",
      "description": "Talent has worked with a brand in the same industry_id as the target but not in the curated competitor graph. Strong proof of category fit; weaker than direct-competitor angle.",
      "trigger": {
        "type": "talent_worked_in_same_industry",
        "config": {}
      },
      "applicable_to_decision_roles": [
        "buyer",
        "influencer"
      ],
      "applicable_to_steps": [
        1,
        2
      ],
      "authored_strength_score": 0.75,
      "example_phrasing": "{talent_name} has done a few campaigns in {industry_display_name} \u2014 most recently with {past_brand}. The {format} drove {result}. We think {target_brand}'s {product_line_or_focus} would resonate with {talent_name}'s audience even more.",
      "merge_fields_required": [
        "talent_name",
        "industry_display_name",
        "past_brand",
        "format",
        "result"
      ],
      "pair_well_with": [
        "niche_primary_affinity",
        "specific_creative_concept"
      ],
      "avoid_combining_with": [
        "past_brand_direct_competitor",
        "past_brand_adjacent_category"
      ]
    },
    {
      "angle_id": "past_brand_adjacent_category",
      "category": "competitive_proof",
      "name": "Worked in an adjacent category",
      "description": "Talent worked in a category that's tertiary in niche_industry_affinity but not direct. Catches cross-pollination patterns (e.g. fitness creator who's done supplements work).",
      "trigger": {
        "type": "talent_worked_in_tertiary_industry",
        "config": {}
      },
      "applicable_to_decision_roles": [
        "buyer"
      ],
      "applicable_to_steps": [
        2,
        3
      ],
      "authored_strength_score": 0.6,
      "example_phrasing": "{talent_name} works mostly in {primary_niche} but recently expanded into {adjacent_category} with {past_brand}. The crossover audience is exactly the demographic {target_brand} targets.",
      "merge_fields_required": [
        "talent_name",
        "primary_niche",
        "adjacent_category",
        "past_brand",
        "target_brand"
      ],
      "avoid_combining_with": [
        "past_brand_direct_competitor",
        "past_brand_same_industry"
      ]
    },
    {
      "angle_id": "similar_talent_partnered_with_brand",
      "category": "similar_talent_precedent",
      "name": "A similar talent has worked with this brand",
      "description": "Direct precedent \u2014 a similar_talent in our system has a documented past campaign with the target brand. Implicit social proof; positions our talent as a natural follow-on.",
      "trigger": {
        "type": "similar_talent_partnered_with_brand",
        "config": {}
      },
      "applicable_to_decision_roles": [
        "buyer",
        "influencer",
        "champion"
      ],
      "applicable_to_steps": [
        1,
        2
      ],
      "authored_strength_score": 0.85,
      "example_phrasing": "Noticed {similar_talent_handle} partnered with {target_brand} on {campaign_reference}. {talent_name} shares ~{audience_overlap_pct}% audience overlap with them \u2014 different content focus, same demographic. Worth a chat about a follow-on campaign with a different angle?",
      "merge_fields_required": [
        "talent_name",
        "similar_talent_handle",
        "target_brand",
        "campaign_reference",
        "audience_overlap_pct"
      ],
      "pair_well_with": [
        "niche_primary_affinity",
        "iab_demographic_overlap"
      ]
    },
    {
      "angle_id": "multiple_similar_talents_with_brand",
      "category": "similar_talent_precedent",
      "name": "Multiple similar talents have worked with this brand",
      "description": "\u22653 similar talents have documented campaigns with the target brand. Signals the brand actively buys creator marketing in this lane; our talent positions as differentiated by a specific angle.",
      "trigger": {
        "type": "multiple_similar_talents_with_brand",
        "config": {
          "min_count": 3
        }
      },
      "applicable_to_decision_roles": [
        "buyer",
        "gatekeeper"
      ],
      "applicable_to_steps": [
        1,
        2
      ],
      "authored_strength_score": 0.9,
      "example_phrasing": "{target_brand} has worked with {similar_talent_count} creators in {talent_name}'s space this year. {talent_name}'s differentiator is {differentiator} \u2014 happy to share the case studies and how the approach compares.",
      "merge_fields_required": [
        "talent_name",
        "target_brand",
        "similar_talent_count",
        "differentiator"
      ],
      "pair_well_with": [
        "specific_creative_concept",
        "performance_proof_case_study"
      ]
    },
    {
      "angle_id": "similar_talent_at_competitor",
      "category": "similar_talent_precedent",
      "name": "Similar talent at a competitor brand",
      "description": "A similar_talent worked with one of the target brand's competitors (not the target itself). Positions our talent as the obvious next move for the target brand.",
      "trigger": {
        "type": "similar_talent_at_competitor",
        "config": {}
      },
      "applicable_to_decision_roles": [
        "buyer"
      ],
      "applicable_to_steps": [
        2
      ],
      "authored_strength_score": 0.7,
      "example_phrasing": "{similar_talent_handle} just did {campaign_type} with {competitor_brand}. We think {target_brand} would benefit from a creator with {talent_name}'s {my_specific_angle_vs_them}.",
      "merge_fields_required": [
        "talent_name",
        "similar_talent_handle",
        "campaign_type",
        "competitor_brand",
        "target_brand",
        "my_specific_angle_vs_them"
      ]
    },
    {
      "angle_id": "iab_demographic_overlap",
      "category": "demographic_match",
      "name": "IAB demographic overlap with brand target",
      "description": "Strong IAB Demographic segment overlap between talent's audience and the brand's target customer profile. Quantitative, data-backed angle.",
      "trigger": {
        "type": "iab_demographic_overlap",
        "config": {
          "min_shared_demo_segments": 3
        }
      },
      "applicable_to_decision_roles": [
        "buyer",
        "influencer"
      ],
      "applicable_to_steps": [
        1,
        2
      ],
      "authored_strength_score": 0.8,
      "example_phrasing": "{talent_name}'s audience is {dominant_gender_pct}% {dominant_gender}, {dominant_age_band} in {top_country} \u2014 direct match for {target_brand}'s {product_target}. Detailed demo report available.",
      "merge_fields_required": [
        "talent_name",
        "dominant_gender_pct",
        "dominant_gender",
        "dominant_age_band",
        "top_country",
        "target_brand",
        "product_target"
      ],
      "pair_well_with": [
        "past_brand_direct_competitor",
        "niche_primary_affinity"
      ]
    },
    {
      "angle_id": "gender_skew_match",
      "category": "demographic_match",
      "name": "Strong gender skew matching brand target",
      "description": "Talent's audience has a strong gender skew (>65%) that matches the brand's primary target demographic.",
      "trigger": {
        "type": "gender_skew_match",
        "config": {
          "min_skew_pct": 65
        }
      },
      "applicable_to_decision_roles": [
        "buyer"
      ],
      "applicable_to_steps": [
        1
      ],
      "authored_strength_score": 0.55,